STT;CODE;Đã thuộc;SENTENCE;MEANING
149;#WFD1966;FALSE;The course includes a combination of pure and applied mathematics.;Khóa học bao gồm sự kết hợp giữa toán học thuần túy và toán học ứng dụng.
150;#WFD1967;FALSE;Sugar is a compound including carbon, oxygen, and hydrogen atoms;Đường là một hợp chất bao gồm các nguyên tử carbon, oxygen và hydrogen.
151;#WFD1970;FALSE;Marine environments have been destroyed through pollution and unsustainable development;Môi trường biển đã bị tàn phá bởi ô nhiễm và sự phát triển không bền vững.
152;#WFD1973;FALSE;All experimental procedures are outlined in the laboratory manual;Tất cả các quy trình thực nghiệm đều được trình bày trong sổ tay thực hành.
153;#WFD1986;FALSE;Students are advised that the lecture today has been canceled;Các sinh viên được thông báo rằng buổi giảng hôm nay đã bị hủy.
154;#WFD1988;FALSE;One of the election promises is to decrease income taxes;Một trong những lời hứa tranh cử là giảm thuế thu nhập.
155;#WFD1990;FALSE;The elective course introduces engineering students to construction practices and concepts;Môn học tự chọn này giới thiệu cho sinh viên ngành kỹ thuật về các phương pháp và khái niệm trong thực hành xây dựng.
156;#WFD1999;FALSE;Having enough sleep has many positive benefits;Ngủ đủ giấc mang lại nhiều lợi ích tích cực.
157;#WFD2001;FALSE;Much of this research is carried out in the laboratory;Phần lớn nghiên cứu này được thực hiện trong phòng thí nghiệm.
158;#WFD2004;FALSE;Plants are the living things that can grow on land or in water;Thực vật là những sinh vật sống có thể phát triển trên cạn hoặc dưới nước.
159;#WFD2007;FALSE;Rising sea temperatures are a sign of climate change;Nhiệt độ biển tăng là một dấu hiệu của biến đổi khí hậu.
160;#WFD2008;FALSE;Scientists were unsure when the early men first left Africa;Các nhà khoa học đã không chắc chắn khi con người thời kỳ đầu lần đầu rời khỏi châu Phi.
161;#WFD2011;FALSE;The area has a variety of underwater habitats and species;Khu vực này có nhiều môi trường sống và loài sinh vật dưới nước đa dạng.
162;#WFD2018;FALSE;The printers automatically print on both sides of each page;Máy in tự động in trên cả hai mặt của mỗi trang.
163;#WFD2021;FALSE;A good abstract highlights the key points of your paper;Một bản tóm tắt tốt làm nổi bật các điểm chính của bài viết của bạn.
164;#WFD2028;FALSE;Certain scientific principles must be learned verbally or by logical deduction;Một số nguyên lý khoa học nhất định phải được học bằng lời nói hoặc bằng suy luận logic.
165;#WFD2030;FALSE;Collaboration between departments is a feature of successful companies;Sự hợp tác giữa các khoa/phòng ban là đặc điểm của các công ty thành công.
166;#WFD2042;FALSE;You need to make sure that all your essays are handed in on time;Bạn cần đảm bảo rằng tất cả các bài tiểu luận của mình được nộp đúng hạn.
167;#WFD2045;FALSE;More research is needed before any definitive conclusion can be drawn;Cần có thêm nghiên cứu trước khi có thể đưa ra bất kỳ kết luận chắc chắn nào.
168;#WFD2052;FALSE;Before attending classes, you must register online or by post.;Trước khi tham gia lớp học, bạn phải đăng ký trực tuyến hoặc qua đường bưu điện
169;#WFD2053;FALSE;Designers need to keep up with the social trends;Các nhà thiết kế cần bắt kịp các xu hướng xã hội.
170;#WFD2058;FALSE;The rise in sea level indicates climate change;Mực nước biển dâng cao cho thấy biến đổi khí hậu.
171;#WFD2065;FALSE;The university library cafe is on the third floor.;Quán cà phê của thư viện trường đại học nằm trên tầng ba.
172;#WFD2183;FALSE;The university auditorium is around the corner;Thính phòng của trường đại học nằm ngay ở góc đường.
173;#WFD2184;FALSE;The professor discussed the article yesterday in this class;Giáo sư đã thảo luận về bài báo đó trong lớp này vào hôm qua.
174;#WFD2185;FALSE;A university degree is required for entry into various professions.;Bằng đại học là yêu cầu bắt buộc để gia nhập nhiều ngành nghề khác nhau.
175;#WFD2186;FALSE;Preparation is important to avoid mishaps in the lab.;Việc chuẩn bị là rất quan trọng để tránh các sự cố trong phòng thí nghiệm.
176;#WFD2187;FALSE;Students are encouraged to monitor their studies by themselves;Học sinh được khuyến khích tự theo dõi việc học của mình.
177;#WFD2188;FALSE;You can find the complex form on the website.;Bạn có thể tìm thấy mẫu đơn phức tạp trên trang web.
